{
  "schemaVersion": 1,
  "amyAbsences": [{ "from": "2026-10-13", "to": "2026-10-15" }],
  "amyDayTargets": {
    "thu": { "min": 1, "max": 2, "preferredStart": { "from": "16:30", "to": "20:15" } },
    "fri": { "min": 1, "max": 1 },
    "sat": { "min": 2, "max": 3 },
    "sun": { "min": 2, "max": 3 }
  },
  "weights": {
    "priority": 100,
    "tristan": 30,
    "amy": 30,
    "onlyMaybe": 10,
    "maybeMultiplier": 0.35,
    "amyBelowTargetPenalty": 25,
    "amyAboveTargetPenalty": 15,
    "amyWindowPenalty": 10
  },
  "paddingMinutes": 0,
  "solver": { "timeBudgetMs": 5000 }
}
